{
  "system_version": "6.8.0",
  "design_contract": "idea-first-v1",
  "project_type": "landing",
  "delivery_profile": "standard",
  "visual_identity_mode": "undetermined",
  "content_model": "undetermined",
  "technology": {"status":"undetermined","choice":"undetermined","decision_artifact":"technology-decision.md"},
  "accessibility_target": "WCAG 2.2 AA",
  "implementation_root": "undetermined"
}



